product_id,product_name,product_category,price_usd,prescription_required,manufacturer,stock_quantity,description
P1000,Minoxidil,Hair,25.99,True,HairGrow Labs,3705,Operation politics record itself wish project drug.
P1001,Finasteride,Hair,39.99,True,HairGrow Labs,133,Professor whom develop find school coach notice newspaper wonder fear board.
P1002,Melatonin,Sleep,12.99,False,SleepWell Inc,9052,Account stage begin our work true hospital remember why along field call.
P1003,Sertraline,Mental Health,44.99,True,MindCare Pharmaceuticals,8560,Only themselves kitchen action indicate apply memory tend trial purpose.
P1004,Tretinoin,Skincare,29.99,True,SkinRenew Co,4772,Mission eye already son weight catch left structure also.
P1005,Ashwagandha,Mental Health,19.99,False,Herbal Remedies,9768,Technology course religious huge road third production.
P1006,Vitamin D,Health,10.99,False,Sunshine Pharma,9467,Night book structure send anything site candidate.
P1007,Hydroxyzine,Allergy,22.99,True,AllerGuard,7936,Around time assume financial house chair history movement young born.
P1008,Ibuprofen,Pain Relief,8.99,False,ReliefRx,6417,Drive five record player interest car hit challenge him family matter evening.
